ÔĽŅrelation_id,respondent_id,transcript_file,segment_id,segment_text,source_construct,relation_type,target_construct,intensity,certainty,memo
1,7,7.txt,0,"brak kierowcňėw na rynku",autonomous_operation,amplifies,workforce_efficiency,0.92,0.94,"Autonomizacja mońĺe ograniczy‚Ä† problem brakňėw kadrowych"
2,7,7.txt,0,"koszt ca¬ąkowity ... inwestycje niezb¬©dne",implementation_cost,conflicts_with,business_acceptance,0.89,0.91,"Wysokie koszty inwestycji ograniczajńĄ wdrańĺanie technologii"
3,7,7.txt,0,"regulacje zwińĄzane z czasem pracy kierowcňėw",regulatory_procedures,suppresses,continuous_transport,0.88,0.9,"Przepisy czasu pracy ograniczajńĄ cińĄg¬ąo¬ė‚Ä† transportu"
4,7,7.txt,0,"duńĺy potencja¬ą na optymalizacj¬©",continuous_transport,amplifies,operational_efficiency,0.9,0.92,"Brak ogranicze√§ czasu pracy zwi¬©ksza efektywno¬ė‚Ä† operacyjnńĄ"
5,7,7.txt,0,"systemy wspomagania kierowcy ... oszcz¬©dzajńĄ paliwo",autonomous_operation,reduces,fuel_consumption,0.87,0.89,"Automatyzacja mońĺe ogranicza‚Ä† zuńĺycie paliwa"
6,7,7.txt,0,"potencja¬ą oszcz¬©dno¬ėci jest wi¬©kszy",fuel_consumption,reduces,energy_reduction,0.84,0.86,"Nińĺsze spalanie oznacza redukcj¬© zuńĺycia energii"
7,7,7.txt,0,"mniej aut jest potrzebnych",continuous_transport,reduces,environmental_impact,0.82,0.84,"Lepsze wykorzystanie floty mońĺe ograniczy‚Ä† wp¬ąyw ¬ėrodowiskowy"
8,7,7.txt,0,"innowacyjno¬ė‚Ä†",autonomous_operation,amplifies,social_image,0.8,0.82,"Wdrońĺenie CAV mońĺe poprawia‚Ä† wizerunek firmy"
9,7,7.txt,0,"mniejsza liczba aut",traffic_efficiency,amplifies,infrastructure_optimization,0.74,0.76,"Mniejsza liczba pojazdňėw mońĺe usprawni‚Ä† wykorzystanie infrastruktury"
10,7,7.txt,0,"wi¬©ksza przewidywalno¬ė‚Ä† pojazdu autonomicznego",autonomous_operation,reduces,accident_reduction,0.76,0.78,"Standaryzacja zachowa√§ mońĺe ogranicza‚Ä† liczb¬© wypadkňėw"
11,7,7.txt,0,"wi¬©ksza standaryzacja decyzji",technology_standardization,amplifies,traffic_efficiency,0.79,0.81,"Standaryzacja decyzji pojazdňėw mońĺe usprawni‚Ä† ruch drogowy"
12,7,7.txt,0,"wi¬©ksza przewidywalno¬ė‚Ä† kosztňėw serwisowych",technology_standardization,stabilizes,operational_efficiency,0.77,0.79,"Standaryzacja eksploatacji zwi¬©ksza przewidywalno¬ė‚Ä† kosztňėw"
13,7,7.txt,0,"automat mňėg¬ąby lepiej radzi‚Ä† sobie",autonomous_operation,amplifies,parking_efficiency,0.73,0.75,"System autonomiczny mońĺe poprawia‚Ä† efektywno¬ė‚Ä† parkowania"
14,7,7.txt,0,"lepsze wykorzystanie samochodňėw",continuous_transport,amplifies,environmental_sustainability,0.81,0.83,"Wi¬©ksza produktywno¬ė‚Ä† floty wspiera zrňėwnowańĺony transport"
15,7,7.txt,0,"koszt poczńĄtkowy nowej technologii",implementation_cost,conflicts_with,business_acceptance,0.92,0.94,"Wysokie koszty poczńĄtkowe utrudniajńĄ adopcj¬© CAV"
16,7,7.txt,0,"zaufanie konsumentňėw ... bardzo duńĺa przeszkoda",technological_trust,conflicts_with,social_acceptance,0.93,0.95,"Niski poziom zaufania ogranicza akceptacj¬© technologii"
17,7,7.txt,0,"technologia, ktňėra b¬©dzie w fazie testňėw",technological_maturity,depends_on,research_support,0.82,0.84,"Rozwňėj technologii wymaga dalszych testňėw i wsparcia badawczego"
18,7,7.txt,0,"¬ėrodki wspierajńĄce badania i rozwňėj",research_support,amplifies,technological_maturity,0.85,0.87,"Finansowanie bada√§ wspiera rozwňėj technologii autonomicznych"
19,7,7.txt,0,"mog¬ąoby zwi¬©kszy‚Ä† zaufanie do technologii",regulatory_procedures,amplifies,technological_trust,0.84,0.86,"Regulacje odpowiedzialno¬ėci zwi¬©kszajńĄ zaufanie do CAV"
20,7,7.txt,0,"odpowiednie zach¬©ty do jej wykorzystania",regulatory_procedures,amplifies,business_acceptance,0.83,0.85,"Wsparcie pa√§stwa mońĺe zwi¬©ksza‚Ä† adopcj¬© technologii"
21,7,7.txt,0,"auto jest za drogie",investment_requirements,conflicts_with,business_acceptance,0.9,0.92,"Wysokie wymagania inwestycyjne ograniczajńĄ wdrońĺenie"
22,7,7.txt,0,"pozyskania dodatkowych ¬ėrodkňėw",investment_requirements,depends_on,autonomous_operation,0.88,0.9,"Wdrońĺenie CAV wymaga dodatkowego finansowania"
23,7,7.txt,0,"dodatkowych pasňėw",infrastructure_optimization,enables,continuous_transport,0.81,0.83,"Rozbudowa infrastruktury wspiera autonomiczny transport"
24,7,7.txt,0,"ochrony ubezpieczeniowej",deployment_risk,conflicts_with,business_acceptance,0.8,0.82,"Niepewno¬ė‚Ä† odpowiedzialno¬ėci zwi¬©ksza ryzyko wdrońĺenia"
25,7,7.txt,0,"szkole√§ dla kierowcňėw",training_requirements,depends_on,technological_maturity,0.74,0.76,"Rozwňėj CAV wymaga nowych kompetencji operatorňėw"
26,7,7.txt,0,"d¬ąuńĺsze dystanse na bardziej standardowych trasach",highway_test_zones,enables,autonomous_operation,0.87,0.89,"Autostrady sńĄ bardziej odpowiednim ¬ėrodowiskiem dla CAV"
27,7,7.txt,0,"ostatnia mila ... duńĺńĄ przeszkod¬©",urban_test_zones,conflicts_with,autonomous_operation,0.86,0.88,"‚ÄĒrodowisko miejskie utrudnia wdrońĺenie autonomii"
28,7,7.txt,0,"czytelno¬ėci znakňėw i sygna¬ąňėw drogowych",signal_visibility,stabilizes,autonomous_operation,0.88,0.9,"Czytelne oznakowanie wspiera dzia¬ąanie systemňėw autonomicznych"
29,7,7.txt,0,"optymalizacja infrastruktury lokalnej",infrastructure_optimization,enables,urban_test_zones,0.8,0.82,"Modernizacja infrastruktury miejskiej wspiera testowanie CAV"
30,7,7.txt,0,"integracja rňėńĺnych systemňėw",supporting_infrastructure,stabilizes,autonomous_operation,0.73,0.75,"Integracja systemňėw ITS wspiera wdrańĺanie CAV"
31,7,7.txt,0,"bardzo wolny rozwňėj technologii",technological_maturity,conflicts_with,autonomous_operation,0.87,0.89,"Powolny rozwňėj technologii ogranicza tempo wdrońĺe√§"
32,7,7.txt,0,"zach¬©ty dla przedsi¬©biorcňėw",research_support,amplifies,business_acceptance,0.84,0.86,"Wsparcie publiczne mońĺe zwi¬©kszy‚Ä† wykorzystanie CAV"
